{"version":"1.0","biomes":["temperate_grassland","mediterranean","coast"],"grid":17,"weights":[[255,239,223,207,191,175,159,143,127,112,96,80,64,48,32,16,0,255,239,223,207,191,175,159,143,127,112,96,80,64,48,32,16,0,255,239,223,207,191,175,159,143,127,112,96,80,64,48,32,16,0,255,239,223,207,191,175,159,143,127,112,96,80,64,48,32,16,0,255,239,223,207,191,175,159,143,127,112,96,80,64,48,32,16,0,255,239,223,207,191,175,159,143,127,112,96,80,64,48,32,16,0,255,239,223,207,191,175,159,143,127,112,96,80,64,48,32,16,0,255,239,223,207,191,175,159,143,127,112,96,80,64,48,32,16,0,255,239,223,207,191,175,159,143,127,112,96,80,64,48,32,16,0,255,239,223,207,191,175,159,143,127,112,96,80,64,48,32,16,0,255,239,223,207,191,175,159,143,127,112,96,80,64,48,32,16,0,255,239,223,207,191,175,159,143,127,98,84,70,56,42,28,14,0,255,239,223,207,191,175,159,143,127,85,73,61,49,37,24,12,0,255,239,223,207,191,175,159,143,127,72,62,52,41,31,21,10,0,255,239,223,207,191,175,159,143,127,59,51,42,34,25,17,8,0,255,239,223,207,191,175,159,143,127,46,39,33,26,20,13,7,0,255,239,223,207,191,175,159,143,127,33,28,23,19,14,9,5,0],[0,16,32,48,64,80,96,112,128,143,159,175,191,207,223,239,255,0,16,32,48,64,80,96,112,128,143,159,175,191,207,223,239,255,0,16,32,48,64,80,96,112,128,143,159,175,191,207,223,239,255,0,16,32,48,64,80,96,112,128,143,159,175,191,207,223,239,255,0,16,32,48,64,80,96,112,128,143,159,175,191,207,223,239,255,0,16,32,48,64,80,96,112,128,143,159,175,191,207,223,239,255,0,16,32,48,64,80,96,112,128,143,159,175,191,207,223,239,255,0,16,32,48,64,80,96,112,128,143,159,175,191,207,223,239,255,0,16,32,48,64,80,96,112,128,143,159,175,191,207,223,239,255,0,16,32,48,64,80,96,112,128,143,159,175,191,207,223,239,255,0,16,32,48,64,80,96,112,128,143,159,175,191,207,223,239,255,0,16,32,48,64,80,96,112,128,127,141,155,169,183,197,211,225,0,16,32,48,64,80,96,112,128,110,122,134,146,158,171,183,195,0,16,32,48,64,80,96,112,128,93,103,113,124,134,144,155,165,0,16,32,48,64,80,96,112,128,76,84,93,101,110,118,127,135,0,16,32,48,64,80,96,112,128,59,66,72,79,85,92,98,105,0,16,32,48,64,80,96,112,128,42,47,52,56,61,66,70,75],[0,0,0,0,0,0,0,0,0,0,0,0,0,0,0,0,0,0,0,0,0,0,0,0,0,0,0,0,0,0,0,0,0,0,0,0,0,0,0,0,0,0,0,0,0,0,0,0,0,0,0,0,0,0,0,0,0,0,0,0,0,0,0,0,0,0,0,0,0,0,0,0,0,0,0,0,0,0,0,0,0,0,0,0,0,0,0,0,0,0,0,0,0,0,0,0,0,0,0,0,0,0,0,0,0,0,0,0,0,0,0,0,0,0,0,0,0,0,0,0,0,0,0,0,0,0,0,0,0,0,0,0,0,0,0,0,0,0,0,0,0,0,0,0,0,0,0,0,0,0,0,0,0,0,0,0,0,0,0,0,0,0,0,0,0,0,0,0,0,0,0,0,0,0,0,0,0,0,0,0,0,0,0,0,0,0,0,0,0,0,0,0,0,0,0,0,30,30,30,30,30,30,30,30,0,0,0,0,0,0,0,0,0,60,60,60,60,60,60,60,60,0,0,0,0,0,0,0,0,0,90,90,90,90,90,90,90,90,0,0,0,0,0,0,0,0,0,120,120,120,120,120,120,120,120,0,0,0,0,0,0,0,0,0,150,150,150,150,150,150,150,150,0,0,0,0,0,0,0,0,0,180,180,180,180,180,180,180,180]],"variant":{"ground":"calcaire_blanc","roofs":"tuile_ronde"}}
